{
  "format": "major-minor/plate-spec@0.1",
  "input": "normalized.json",
  "sourceHash": "2c6668f9e0426ad3a58a6c24621025d88722102020e4efc0739a51423138f58e",
  "normalizedHash": "7b8a57704974ee7aef9e34c5f212655a5ab8bf7aa47157ffb385d348e125fcf9",
  "rendererVersion": "0.1.0",
  "visualVersion": "0.1",
  "seed": 17017,
  "dimensions": {
    "width": 960,
    "height": 1260
  },
  "scales": {
    "latency_ms": [
      0,
      15000
    ],
    "tokens_per_second": [
      0,
      50
    ],
    "memory_gb": [
      0,
      10
    ]
  },
  "mappings": {
    "position": "unit array order; row-major fixed 4-column grid",
    "integrity": "one trace per run; intact=true, fractured=false, open diamond=null",
    "latency": "linear path horizontal extent, 0..series maximum rounded up to 5000 ms",
    "throughput": "floor(tokens_per_second / 10) pulses; pulses equally spaced on the trace",
    "resource": "mean observed memory_gb sets five-run envelope; 24 + 48 * GB / shared maximum",
    "variance": "run latency minus unit/condition median; displacement = 0.15 * lane spacing * difference / shared latency maximum",
    "error": "declared category selects a fixed fracture mask; unclassified failures use other",
    "color": "successful trace=ink, successful endpoint=verdigris, failed trace=oxide, missing=ink",
    "missing": "open diamond for missing outcome; metric-specific open markers for missing numeric channels",
    "summary": "observed-success ratio; medians exclude missing values; coverage reported explicitly"
  }
}
